question_id,question,qwen_rag_score,qwen_rag_label,gemma_rag_score,gemma_rag_label,qwen_norag_score,qwen_norag_label,gemma_norag_score,gemma_norag_label,best_pipeline,notes
21,Find Georgia suppliers with existing Hyundai Kia contracts that could be expanded to support Hyundai Metaplant's EV battery production ramp-up.,0.6,partially_correct,0.85,correct,0.4,partially_correct,0.4,partially_correct,gemma_rag,"qwen_rag: The model-generated answer contains some of the required entities (F&P Georgia Manufacturing, Hyundai Motor Group, Hitachi Astemo Americas Inc., Hollingsworth & Vose Co., Honda Development & Manufacturing) but is missing several others listed in the gold answer. | gemma_rag: The model-generated answer contains all required gold entities (F&P Georgia Manufacturing, Hyundai Motor Group, Hitachi Astemo Americas Inc., Hollingsworth & Vose Co., and Honda Development & Manufacturing) with correct mappings to Hyundai Kia contracts that could be expanded. The count of 5 companies is close to the gold answer's count of 11, but still within a reasonable margin for minor omissions. | qwen_norag: The model-generated answer partially identifies the task but fails to provide specific company names and contract details, which are crucial for supporting Hyundai Metaplant's EV battery production ramp-up. | gemma_norag: The model-generated answer is partly correct with important missing pieces. It correctly identifies the need for suppliers specializing in battery components, thermal management systems, and electrical wiring harnesses, but fails to provide specific companies that match the gold answer."
22,"Identify Georgia companies producing DC-to-DC converters, capacitors, or power electronics components relevant to EV drivetrains and what tier is each assigned?",0.85,correct,0.6,partially_correct,0.4,partially_correct,0.0,incorrect,qwen_rag,"qwen_rag: The model-generated answer contains all required entities and mappings from the gold answer, but lacks some narrative framing and includes extra harmless metadata. The count of companies is correct (3), and the top entities (GSC Steel Stamping LLC, Hyundai MOBIS (Georgia), and Hyundai Transys Georgia Seating Systems) are correctly identified with their respective tiers. | gemma_rag: The model-generated answer contains some of the required entities and mappings, but is incomplete and includes extraneous information. | qwen_norag: The model-generated answer is partly correct with important missing pieces. It correctly identifies the relevance of companies in Georgia's automotive supply chain but fails to provide specific company names and their corresponding tiers, which are crucial for answering the question. | gemma_norag: The model-generated answer does not provide any specific Georgia companies producing DC-to-DC converters, capacitors, or power electronics components relevant to EV drivetrains, nor does it mention the correct tier for each company."
23,"Which Georgia companies provide powder coating-related products or services, and what tier are they classified under?",0.85,correct,0.85,correct,0.4,partially_correct,0.4,partially_correct,tie,"qwen_rag: The model-generated answer contains the core entity (Archer Aviation Inc.) and its tier classification, which matches the gold answer. However, it includes extra metadata such as OEMs, employment count, location, and facility fields that are not present in the gold answer. | gemma_rag: The model-generated answer contains the core entity (Archer Aviation Inc.) and its tier classification, which matches the gold answer. However, it includes extra metadata such as OEMs, employment count, location, and facility details that are not present in the gold answer. | qwen_norag: The model-generated answer is partly correct with important missing pieces. It correctly identifies that companies providing powder coating-related products or services in Georgia would be classified under manufacturing or industrial service tiers, but it fails to provide a specific company as the gold answer does. | gemma_norag: The model-generated answer is partly correct with important missing pieces. It correctly identifies the general types of companies that provide powder coating-related products or services in Georgia, but fails to provide specific company names and their tiers as requested."
24,"Which Georgia companies manufacture battery parts or enclosure systems and are classified as Tier 1/2, making them ready for direct OEM engagement and show which Primary OEMs they are linked to.",0.85,correct,0.95,correct,0.4,partially_correct,0.4,partially_correct,gemma_rag,"qwen_rag: The model-generated answer contains all required gold entities and mappings, but omits the narrative preamble and some metadata fields. | gemma_rag: The model-generated answer contains all required entities and mappings from the gold answer, with some minor differences in wording and metadata. The core information about Georgia companies manufacturing battery parts or enclosure systems and classified as Tier 1/2 is accurately represented. | qwen_norag: The model-generated answer is partly correct with important missing pieces. It correctly identifies the type of companies (Tier 1/2) and their involvement in direct OEM engagement, but fails to provide specific company names and their corresponding Primary OEMs. | gemma_norag: The model-generated answer is partly correct with important missing pieces. It correctly identifies the need for detailed supply chain data and mentions potential candidates, but fails to provide specific Georgia companies meeting the Tier 1/2 classification and their exact OEM links."
25,Find Tier 2/3 Georgia-based suppliers with employment over 300 that are classified as General Automotive but produce components transferable to EV platforms.,0.6,partially_correct,0.85,correct,0.0,incorrect,0.4,partially_correct,gemma_rag,"qwen_rag: The model-generated answer contains some of the required entities and mappings, but is incomplete and lacks several key suppliers mentioned in the gold answer. | gemma_rag: The model-generated answer contains all required gold entities and mappings, but omits the narrative preamble and includes extra harmless metadata. | qwen_norag: The model-generated answer does not provide any specific information about Tier 2/3 Georgia-based suppliers with employment over 300 that are classified as General Automotive but produce components transferable to EV platforms, and instead provides a general explanation. | gemma_norag: The model-generated answer is partly correct with important missing pieces. It correctly identifies the need for a supplier database and the importance of detailed classifications, but fails to provide any specific Tier 2/3 Georgia-based suppliers that meet the criteria."
26,Identify Georgia Tier 2/3 companies in the Chemicals and Allied Products industry group and list their products.,0.85,correct,0.85,correct,0.0,incorrect,0.0,incorrect,tie,"qwen_rag: The model-generated answer contains the same two companies as the gold answer and lists their products correctly. However, it lacks the exact count of companies mentioned in the gold answer (""There are 2 Georgia Tier 2/3 companies...""), which is a minor omission. | gemma_rag: The model-generated answer contains all required gold entities and mappings, but omits the narrative preamble and includes extra harmless metadata. | qwen_norag: The model-generated answer is off-topic and does not provide the required information about Georgia Tier 2/3 companies in the Chemicals and Allied Products industry group and their products. | gemma_norag: The model-generated answer is off-topic and does not provide the required information about Georgia Tier 2/3 companies in the Chemicals and Allied Products industry group and their products."
27,"Which EV Supply Chain Roles in Georgia are served by only a single company, creating a single-point-of-failure risk for the state's EV ecosystem?",0.95,correct,0.95,correct,0.0,incorrect,0.4,partially_correct,tie,"qwen_rag: The model-generated answer contains all required gold entities and mappings with minor omissions in narrative preamble. | gemma_rag: The model-generated answer contains all required gold entities and mappings with minor omissions in narrative preamble. | qwen_norag: The model-generated answer does not provide any specific information about the EV Supply Chain Roles in Georgia that are served by only a single company, creating a single-point-of-failure risk for the state's EV ecosystem. | gemma_norag: The model-generated answer is partly correct with some important missing pieces. It acknowledges the need for a detailed mapping of EV supply chain roles and companies in Georgia, but fails to provide specific examples or a list of single-point-of-failure risks as requested."
28,"Which Georgia Battery Cell or Battery Pack suppliers are sole-sourced by a specific OEM, indicating high dependency risk?",0.85,correct,0.85,correct,0.4,partially_correct,0.4,partially_correct,tie,"qwen_rag: The model-generated answer contains all required gold entities (F&P Georgia Manufacturing, Hollingsworth & Vose Co., IMMI, Hyundai Motor Group) but omits two other sole-sourced suppliers mentioned in the gold answer (Hitachi Astemo Americas Inc. and Honda Development & Manufacturing). | gemma_rag: The model-generated answer contains all required gold entities and mappings, but omits the narrative preamble and some metadata fields. | qwen_norag: The model-generated answer is partly correct with important missing pieces. It correctly identifies the concept of sole-sourcing and dependency risk, but fails to provide specific suppliers as requested in the gold answer. | gemma_norag: The model-generated answer partially identifies the concept of sole-sourcing and dependency risk, but fails to provide specific suppliers as requested in the gold answer."
29,"For Hyundai Metaplant, how many of its Georgia-based EV component suppliers have fewer than 200 employees, flagging potential capacity fragility?",0.6,partially_correct,0.85,correct,0.0,incorrect,0.0,incorrect,gemma_rag,"qwen_rag: The model-generated answer contains three companies that are indeed EV component suppliers based in Georgia with fewer than 200 employees, but it lacks the exact count of 6 and does not provide employment information for each company. | gemma_rag: The model-generated answer contains all required gold entities and mappings, but omits the narrative preamble and some extra metadata. The count of suppliers with fewer than 200 employees is correct (6), and the top entities are mostly correct, except for Hyundai MOBIS (Georgia) which was not in the gold answer. | qwen_norag: The model-generated answer does not provide a specific number of Georgia-based EV component suppliers for Hyundai Metaplant with fewer than 200 employees, which is the core requirement of the question. | gemma_norag: The model-generated answer is off-topic and does not provide a factual alignment with the gold answer."
30,"Identify Georgia Tier 2/3 suppliers that are EV Relevant, classified as General Automotive, and provide materials to Battery Cell or Battery Pack companies, suggesting supply chain misalignment risk.",0.0,incorrect,0.0,incorrect,0.4,partially_correct,0.4,partially_correct,tie,"qwen_rag: The model-generated answer does not provide any information about Georgia Tier 2/3 suppliers that are EV Relevant, classified as General Automotive, and provide materials to Battery Cell or Battery Pack companies, suggesting supply chain misalignment risk. | gemma_rag: The model-generated answer does not provide any information about Georgia Tier 2/3 suppliers that are EV Relevant, classified as General Automotive, and provide materials to Battery Cell or Battery Pack companies, suggesting supply chain misalignment risk. | qwen_norag: The model-generated answer is partly correct with important missing pieces. It correctly identifies the context of Tier 2/3 suppliers in Georgia relevant to EVs, but fails to provide specific supplier names as requested. | gemma_norag: The model-generated answer is partly correct with some important missing pieces. It correctly identifies the type of suppliers and potential components they provide, but it does not specifically mention the two Georgia Tier 2/3 suppliers that are EV Relevant, classified as General Automotive, and provide materials to Battery Cell or Battery Pack companies."
31,Identify all Georgia-based Tier 1/2 automotive suppliers that maintain a diversified customer base (serving 'Multiple OEMs').,0.95,correct,0.95,correct,0.4,partially_correct,0.4,partially_correct,tie,"qwen_rag: The model-generated answer contains all required gold entities and mappings, with the same count of suppliers (11) and accurate descriptions of their products and customers. The only minor difference is that the model-generated answer includes extra metadata such as tier, OEM, and product categories, but this does not affect the core correctness of the answer. | gemma_rag: The model-generated answer contains all required gold entities and mappings, with the same count of suppliers (11) and accurate descriptions of their products and customers. The only minor difference is that the model-generated answer includes extra metadata such as tier, OEM, and product categories, but this does not affect the core correctness of the answer. | qwen_norag: The model-generated answer is partly correct with some important missing pieces. It correctly identifies the type of suppliers (Tier 1/2) and their location (Georgia), but it fails to provide a specific list of companies, which is a crucial part of the question. | gemma_norag: The model-generated answer is partly correct with some important missing pieces. It correctly identifies the Tier 1/2 suppliers and their characteristics, but it fails to provide a complete list of Georgia-based companies that meet the criteria."
32,Identify Georgia companies in the Thermal Management or Power Electronics role with fewer than 200 employees - their small scale may limit surge production capacity.,0.6,partially_correct,0.85,correct,0.0,incorrect,0.4,partially_correct,gemma_rag,"qwen_rag: The model-generated answer contains some of the required information, but it is incomplete and lacks accuracy in certain aspects. It mentions Hyundai Transys Georgia Powertrain as a company with fewer than 200 employees in Thermal Management or Power Electronics role, which is correct. However, it also includes irrelevant details such as 'Tier 1/2', 'Electrical heaters, control units, and actuators', and 'Hyundai Kia Rivian' which are not present in the gold answer. Additionally, it does not provide information about the other two companies mentioned in the gold answer (Freudenberg-NOK and Peerless-Winsmith Inc.). | gemma_rag: The model-generated answer contains all required gold entities and mappings, but omits the exact count of companies in the Thermal Management or Power Electronics role with fewer than 200 employees. | qwen_norag: The model-generated answer is incorrect and off-topic because it does not provide the required information about specific Georgia companies in the Thermal Management or Power Electronics role with fewer than 200 employees. | gemma_norag: The model-generated answer is partly correct with important missing pieces. It correctly identifies the specialized nature of thermal management and power electronics companies, but fails to provide specific company names as requested in the gold answer."
33,Identify any EV-relevant Georgia companies classified as OEM Footprint or OEM Supply Chain?,0.95,correct,0.85,correct,0.4,partially_correct,0.4,partially_correct,qwen_rag,"qwen_rag: The model-generated answer contains all required gold entities and mappings, with some minor differences in wording and metadata. The core information is accurate and complete. | gemma_rag: The model-generated answer contains all required gold entities and mappings, but omits the narrative preamble and includes extra metadata. | qwen_norag: The model-generated answer is partly correct with some important missing pieces. It correctly identifies the context of OEM Footprint or OEM Supply Chain companies in Georgia, but fails to provide a specific list of companies as requested. | gemma_norag: The model-generated answer is partly correct with some important missing pieces. It correctly identifies the need for OEM-specific data and mentions Georgia's efforts to attract EV manufacturing, but it fails to provide a specific list of companies classified as OEM Footprint or OEM Supply Chain."
34,"Top 10 Georgia companies based on employment size that supply both General Automotive and EV-specific components, indicating transition readiness?",0.85,correct,0.85,correct,0.4,partially_correct,0.4,partially_correct,tie,"qwen_rag: The model-generated answer contains most of the top Georgia companies based on employment size that supply both General Automotive and EV-specific components, but it lacks a few entities present in the gold answer (e.g., Fouts Brothers Fire Equipment, Arising Industries Inc.). The core entities, mappings, counts, and locations match the gold answer for the most part. | gemma_rag: The model-generated answer contains all required top entities and mappings, but lacks the exact employment counts and narrative framing of the gold answer. | qwen_norag: The model-generated answer is partly correct with some important missing pieces. It correctly identifies the need for major suppliers with a significant presence in Georgia's manufacturing sector, but fails to provide specific companies that meet the criteria. | gemma_norag: The model-generated answer is partly correct with some important missing pieces. It correctly identifies the types of companies involved in both traditional automotive and EV components, but fails to provide a specific list of top 10 Georgia companies as requested."
35,"How many Georgia companies are now producing lithium-ion battery materials, cells, or electrolytes?",0.95,correct,0.95,correct,0.0,incorrect,0.4,partially_correct,tie,"qwen_rag: The model-generated answer contains the same core entities and mappings as the gold answer, with a minor difference in formatting. The count of Georgia companies producing lithium-ion battery materials is also correct. | gemma_rag: The model-generated answer contains the same core entities and mappings as the gold answer, with a minor difference in formatting. The count of Georgia companies producing lithium-ion battery materials is also correct. | qwen_norag: The model-generated answer does not provide a specific number of Georgia companies producing lithium-ion battery materials, cells, or electrolytes, whereas the gold answer provides an exact count (5). The model's uncertainty and lack of specificity result in a score of 0.00. | gemma_norag: The model-generated answer is partly correct with some important missing pieces. It acknowledges the difficulty of providing an exact count and mentions recent investments in battery manufacturing, but it does not provide a specific number or list of companies as requested."
36,Which Georgia Tier 2/3 suppliers currently produce lightweight aluminum or composite materials and are growing their EV-specific customer base?,0.0,incorrect,0.0,incorrect,0.4,partially_correct,0.0,incorrect,qwen_norag,"qwen_rag: The model-generated answer does not provide any information about the Tier 2/3 suppliers currently producing lightweight aluminum or composite materials and growing their EV-specific customer base, which is a direct contradiction to the human-validated gold answer. | gemma_rag: The model-generated answer does not provide any information about the Tier 2/3 suppliers in Georgia that produce lightweight aluminum or composite materials and are growing their EV-specific customer base, which is a direct contradiction to the human-validated gold answer. | qwen_norag: The model-generated answer is partly correct with important missing pieces. It acknowledges the existence of Tier 2/3 suppliers in Georgia producing lightweight materials and expanding their customer base in the EV sector, but fails to provide specific names and details about their growth. | gemma_norag: The model-generated answer is off-topic and does not provide the required information about specific Tier 2/3 suppliers in Georgia producing lightweight aluminum or composite materials and growing their EV-specific customer base."
37,"Identify Georgia companies whose product descriptions include 'high-voltage', 'DC-to-DC', 'inverter', or 'motor controller' — these signal EV powertrain electronics growth.",0.85,correct,0.6,partially_correct,0.4,partially_correct,0.4,partially_correct,qwen_rag,"qwen_rag: The model-generated answer contains all required gold entities and mappings, but lacks the narrative preamble. The count of Georgia companies is also correct. | gemma_rag: The model-generated answer contains some of the required entities and mappings, but is incomplete and lacks accuracy in certain aspects. | qwen_norag: The model-generated answer is partly correct with important missing pieces. It correctly identifies the context of EV powertrain electronics growth and mentions relevant product signals, but it fails to provide a specific company name or count as requested in the gold answer. | gemma_norag: The model-generated answer is partly correct with important missing pieces. It correctly identifies the need for a specific list of Georgia-based companies and their product catalogs, but fails to provide any actual company names or details matching the gold answer."
38,"Which Georgia automotive companies employ over 1,000 workers but are currently categorized as only ""Indirectly Relevant"" to the EV sector, indicating a massive workforce pool ready for a strategic pivot?",0.4,partially_correct,0.85,correct,0.4,partially_correct,0.4,partially_correct,gemma_rag,"qwen_rag: The model-generated answer partially matches the gold answer by mentioning Textron Specialized Vehicles, but it lacks information about the other two companies (TCI Powder Coatings and Teklas USA) and does not provide a clear indication of their indirect relevance to the EV sector. | gemma_rag: The model-generated answer contains all required entities and mappings from the gold answer, but omits some details such as employment counts and roles. | qwen_norag: The model-generated answer is partly correct with important missing pieces. It correctly identifies the type of companies (traditional vehicle manufacturers or suppliers) but fails to provide specific company names and details, which are crucial for a complete answer. | gemma_norag: The model-generated answer is partly correct with important missing pieces. It correctly identifies the type of companies (large automotive suppliers) that would fit the description, but fails to provide specific examples or exact counts as required by the gold answer."
39,"Which three Georgia companies have the largest employment in EV thermal management, and how many employees does each have?",0.4,partially_correct,0.85,correct,0.4,partially_correct,0.0,incorrect,gemma_rag,"qwen_rag: The model-generated answer is partly correct with important missing pieces. It correctly identifies Novelis Inc. as one of the companies, but fails to provide information about two other companies that meet the criteria specified in the question. | gemma_rag: The model-generated answer contains the top three Georgia companies with significant employment in EV thermal management: ZF Gainesville LLC, Voestalpine Automotive Body Parts Inc., and Novelis Inc. However, it incorrectly states that ZF Gainesville LLC has 170000 employees (gold answer says 17,500), and Voestalpine is not mentioned in the gold answer. The model-generated answer also includes extra metadata such as 'EV body, powertrain, and thermal components' which is not present in the gold answer. | qwen_norag: The model-generated answer is partly correct with important missing pieces. It correctly identifies the context of EV thermal management in Georgia but fails to provide specific company names and employment counts, which are crucial for a complete answer. | gemma_norag: The model-generated answer is off-topic and does not provide the required information about the three Georgia companies with the largest employment in EV thermal management."
40,"Which companies are involved in thermal-related products or services, and what roles and facility types are they associated with?",0.85,correct,0.85,correct,0.4,partially_correct,0.4,partially_correct,tie,"qwen_rag: The model-generated answer contains all required gold entities and mappings, but omits some narrative preamble and includes extra harmless metadata. | gemma_rag: The model-generated answer contains all required gold entities and mappings, but omits some narrative preamble and includes extra harmless metadata. | qwen_norag: The model-generated answer is partly correct with important missing pieces. It mentions the types of companies involved in thermal-related products or services, but it does not provide specific company names and roles as required by the question. | gemma_norag: The model-generated answer is partly correct with some important missing pieces. It correctly identifies various types of companies involved in thermal-related products or services, but it fails to provide specific company names and their associated roles and facility types as requested."
