question_id,question,qwen_rag_score,qwen_rag_label,gemma_rag_score,gemma_rag_label,qwen_norag_score,qwen_norag_label,gemma_norag_score,gemma_norag_label,best_pipeline,notes
1,"Show all ""Tier 1/2"" suppliers in Georgia, list their EV Supply Chain Role and Product / Service.",0.6,partially_correct,0.85,correct,0.4,partially_correct,0.4,partially_correct,gemma_rag,"qwen_rag: The model-generated answer contains some of the required entities and mappings, but is incomplete and lacks several key suppliers listed in the gold answer. | gemma_rag: The model-generated answer contains all required gold entities and mappings, but omits some narrative preamble and includes extra harmless metadata. | qwen_norag: The model-generated answer is partly correct with some important missing pieces. It correctly identifies the types of companies that would typically be included in Georgia's EV supply chain, but it does not provide a specific list of Tier 1/2 suppliers as requested. | gemma_norag: The model-generated answer is partly correct with some important missing pieces. It correctly identifies the types of companies involved in the EV supply chain (battery production, electric motor manufacturing, power electronics) and mentions that specific supplier tiers and product details require the dataset. However, it does not provide a list of Tier 1/2 suppliers in Georgia as requested."
2,"Which Georgia companies are classified under Battery Cell or Battery Pack roles, and what tier is each assigned?",0.85,correct,0.85,correct,0.4,partially_correct,0.4,partially_correct,tie,"qwen_rag: The model-generated answer is mostly correct and complete, but it lacks the company roles (Battery Cell or Battery Pack) which are present in the gold answer. | gemma_rag: The model-generated answer contains all required gold entities and mappings, but omits the narrative preamble and includes extra harmless metadata. | qwen_norag: The model-generated answer is partly correct with some important missing pieces. It correctly identifies the types of companies involved (Battery Cell or Battery Pack) but fails to provide specific company names and their corresponding tiers, which are essential details in the gold answer. | gemma_norag: The model-generated answer is partly correct with some important missing pieces. It correctly identifies the types of companies involved in battery cell or pack roles (automotive manufacturers, energy storage companies, and battery manufacturers) but fails to provide specific company names matching the gold answer. The tier assignments are also unknown without the dataset."
3,Map all Thermal Management suppliers in Georgia and show which Primary OEMs they are linked to.,0.85,correct,0.85,correct,0.0,incorrect,0.4,partially_correct,tie,"qwen_rag: The model-generated answer contains all required Thermal Management suppliers in Georgia and their linked Primary OEMs, with some minor omissions of narrative preamble and extra metadata. The core entities, mappings, counts, and locations match the gold answer. | gemma_rag: The model-generated answer contains all required Thermal Management suppliers in Georgia and their linked Primary OEMs, with some minor differences in wording and metadata. | qwen_norag: The model-generated answer is off-topic and does not provide the required information about Thermal Management suppliers in Georgia and their links to Primary OEMs. | gemma_norag: The model-generated answer is partly correct with important missing pieces. It correctly identifies the sectors that thermal management suppliers support in Georgia, but fails to provide specific companies and their linked Primary OEMs as requested."
4,"List every Georgia company classified under Power Electronics or Charging Infrastructure, along with their Employment size.",0.85,correct,0.85,correct,0.4,partially_correct,0.4,partially_correct,tie,"qwen_rag: The model-generated answer contains all required gold entities and mappings, but omits some narrative preamble and includes extra harmless metadata. | gemma_rag: The model-generated answer contains all required entities and mappings from the gold answer, but omits some details such as combined roles and narrative framing. | qwen_norag: The model-generated answer is partly correct with important missing pieces. It correctly identifies the categories of Power Electronics and Charging Infrastructure, but fails to provide specific company names and employment sizes as requested in the gold answer. | gemma_norag: The model-generated answer is partly correct with important missing pieces. It correctly identifies the sectors (Power Electronics or Charging Infrastructure) but fails to provide specific company names and employment sizes, which are crucial for a complete answer."
5,"Which companies are classified as Direct Manufacturer, and what EV Supply Chain Roles do they cover?",0.6,partially_correct,0.85,correct,0.0,incorrect,0.0,incorrect,gemma_rag,"qwen_rag: The model-generated answer contains some of the required companies and their corresponding EV Supply Chain Roles, but it is incomplete and contains incorrect information. For example, Kia Georgia Inc. and Textron Specialized Vehicles are missing from the list, and some of the roles mentioned do not match the gold answer. | gemma_rag: The model-generated answer contains all required gold entities and mappings, but omits some narrative preamble and extra harmless metadata. | qwen_norag: The model-generated answer does not provide the required information about companies classified as Direct Manufacturer and their corresponding EV Supply Chain Roles, which are present in the gold answer. | gemma_norag: The model-generated answer is off-topic and does not provide the required information about companies classified as Direct Manufacturer and their corresponding EV Supply Chain Roles."
6,"What locations does Novelis Inc. operate in, and what primary facility types are associated with each location?",0.6,partially_correct,0.85,correct,0.0,incorrect,0.0,incorrect,gemma_rag,"qwen_rag: The model-generated answer is substantially correct but incomplete. It correctly identifies Atlanta, Fulton County as a location and Manufacturing Plant as the primary facility type, but it does not provide the exact count of locations or confirm that all three are located in Atlanta, Fulton County. | gemma_rag: The model-generated answer is a paraphrased version of the gold answer, with some minor omissions. It correctly identifies Atlanta, Fulton County as the location and Manufacturing Plant as the primary facility type, but does not provide the exact count or mention that all three facilities are located in Atlanta. | qwen_norag: The model-generated answer does not provide the specific locations and primary facility types associated with Novelis Inc., which are provided in the gold answer. | gemma_norag: The model-generated answer is off-topic and does not provide the required information about Novelis Inc.'s locations and primary facility types."
7,"In Gwinnett County, which company has the highest Employment and what is its EV Supply Chain Role?",0.95,correct,0.95,correct,0.4,partially_correct,0.4,partially_correct,tie,"qwen_rag: The model-generated answer is essentially correct with minor omissions. The core entities (WIKA USA), mappings (Employment: 250000, Role: HV and LV wiring harnesses for EVs and ICE vehicles), and location (Gwinnett County) match the gold answer. However, the model's answer lacks a narrative preamble and includes extra harmless metadata. | gemma_rag: The model-generated answer is essentially correct with minor omissions. The core entities (WIKA USA), mappings (Employment: 250000, Role: HV and LV wiring harnesses for EVs and ICE vehicles), and location (Gwinnett County) match the gold answer. However, the model's answer lacks a narrative preamble and includes extra harmless metadata. | qwen_norag: The model-generated answer is partly correct with important missing pieces. It acknowledges the difficulty of determining the exact dataset-specific answer, but fails to provide any specific information about the company with the highest employment in Gwinnett County and its role in the EV supply chain. | gemma_norag: The model-generated answer is partly correct with important missing pieces. It correctly identifies the sectors that large employers in Gwinnett County are often in, but fails to provide a specific company with the highest employment and its EV Supply Chain Role."
8,Which county have the highest total Employment among Tier 1 suppliers only?,0.95,correct,0.95,correct,0.0,incorrect,0.0,incorrect,tie,"qwen_rag: Core entities and count match the gold answer, but lacks narrative framing. | gemma_rag: Core entities and count match the gold answer, but lacks narrative framing. | qwen_norag: The model-generated answer does not provide a specific county with the highest total employment among Tier 1 suppliers, whereas the gold answer provides a clear and specific answer (Troup County). The model's response is vague and lacks factual alignment. | gemma_norag: The model-generated answer is off-topic and does not provide a specific county with the highest total Employment among Tier 1 suppliers, instead providing a general explanation."
9,"Which county has the highest total employment across all companies, and what is the combined employment in that county?",0.95,correct,0.95,correct,0.0,incorrect,0.0,incorrect,tie,"qwen_rag: Core entities and counts match the gold answer, but lacks narrative framing. | gemma_rag: Core entities and counts match the gold answer, but lacks narrative framing. | qwen_norag: The model-generated answer does not provide the required information: the county with the highest total employment and its combined employment. | gemma_norag: The model-generated answer is off-topic and does not provide a specific county with the highest total employment or the combined employment in that county."
10,Identify all Vehicle Assembly facilities in Georgia and list the corresponding Primary OEM associated with each facility.,0.6,partially_correct,0.85,correct,0.0,incorrect,0.4,partially_correct,gemma_rag,"qwen_rag: The model-generated answer contains some of the required Vehicle Assembly facilities in Georgia and their corresponding Primary OEMs, but it is incomplete as it misses several facilities listed in the gold answer. | gemma_rag: The model-generated answer contains all required Vehicle Assembly facilities in Georgia and their corresponding Primary OEMs, with the exception of a few minor omissions (e.g., Thermal Ceramics Inc.'s Primary OEM is listed as SK Battery America instead of being explicitly mentioned). The core entities, mappings, counts, and locations match the gold answer, demonstrating substantial correctness and completeness. | qwen_norag: The model-generated answer does not provide any specific information about Vehicle Assembly facilities in Georgia and their corresponding Primary OEMs, whereas the gold answer provides a detailed list of such facilities along with their primary OEM associations. | gemma_norag: The model-generated answer is partly correct with some important missing pieces. It correctly identifies that vehicle assembly facilities are associated with major automotive manufacturers and mentions Georgia's attraction to automotive manufacturing. However, it fails to provide a specific list of Vehicle Assembly OEMs in Georgia along with their Primary OEMs as requested."
11,Identify the primary products and services associated with Sewon America Inc. across its different operational sites in Georgia.,0.95,correct,0.95,correct,0.4,partially_correct,0.4,partially_correct,tie,"qwen_rag: The model-generated answer accurately lists the primary products and services associated with Sewon America Inc. across its different operational sites in Georgia, matching the core entities, mappings, and counts of the gold answer. The only minor difference is the inclusion of extra metadata such as 'Tier 1', 'General Automotive', and 'Multiple OEMs' which do not affect the factual correctness. | gemma_rag: The model-generated answer accurately identifies the primary products and services associated with Sewon America Inc. across its different operational sites in Georgia, matching the core entities, mappings, and counts of the gold answer. The only minor difference is the inclusion of extra metadata such as 'Tier 1', 'General Automotive', and 'Multiple OEMs' which do not affect the factual correctness of the answer. | qwen_norag: The model-generated answer is partly correct with important missing pieces. It correctly identifies the company's core business operations, but fails to provide specific products and services associated with Sewon America Inc. in Georgia. | gemma_norag: partly correct with important missing pieces"
12,List all Tier 2/3 companies in Georgia with primary involvement in the electric vehicle or battery supply chain and specify their respective roles.,0.85,correct,0.85,correct,0.4,partially_correct,0.4,partially_correct,tie,"qwen_rag: The model-generated answer contains all required gold entities and mappings, but omits the narrative preamble and includes extra harmless metadata. | gemma_rag: The model-generated answer contains all required gold entities and mappings, but omits the narrative preamble and includes extra harmless metadata. | qwen_norag: The model-generated answer is partly correct with important missing pieces. It correctly identifies the involvement of Tier 2/3 companies in Georgia's electric vehicle or battery supply chain, but fails to provide specific company names and roles as requested. | gemma_norag: The model-generated answer is partly correct with important missing pieces. It correctly identifies the need for detailed supply chain mapping data and mentions various roles in the EV/battery supply chain, but fails to provide specific companies involved in Georgia."
13,"Show the full supplier network linked to Rivian Automotive in Georgia, broken down by tier and EV Supply Chain Role.",0.85,correct,0.85,correct,0.0,incorrect,0.4,partially_correct,tie,"qwen_rag: The model-generated answer contains all required gold entities and mappings, but omits some narrative preamble and extra metadata. | gemma_rag: The model-generated answer contains all required gold entities and mappings, but omits some narrative preamble and extra metadata. | qwen_norag: The model-generated answer is off-topic and does not provide the required information about Rivian Automotive's supplier network in Georgia, broken down by tier and EV Supply Chain Role. | gemma_norag: The model-generated answer attempts to explain the structure of Rivian's supplier network in Georgia but fails to provide specific companies and their roles, which are crucial for a complete answer."
14,"Which Georgia companies produce battery materials such as anodes, cathodes, electrolytes, or copper foil, and what tier are they classified as?",0.95,correct,0.95,correct,0.0,incorrect,0.4,partially_correct,tie,"qwen_rag: The model-generated answer contains all required gold entities and mappings, with the same tier classification for each company. The only minor omission is the lack of narrative preamble describing the companies' products. | gemma_rag: The model-generated answer contains all required gold entities and mappings, with the same tier classification for each company. The only minor omission is the lack of narrative preamble describing the companies' products. | qwen_norag: The model-generated answer does not provide any specific companies in Georgia that produce battery materials, and instead provides a general explanation of how tiers are determined. | gemma_norag: The model-generated answer is partly correct with important missing pieces. It correctly identifies the tier classification system and mentions that Georgia has attracted some battery manufacturing, which implies component production would be present. However, it fails to provide specific company details, which are crucial for a complete answer."
15,Identify all Georgia companies with an EV Supply Chain Role related to wiring harnesses and show their Primary OEMs.,0.85,correct,0.85,correct,0.0,incorrect,0.4,partially_correct,tie,"qwen_rag: The model-generated answer contains the same two Georgia companies with an EV Supply Chain Role related to wiring harnesses as the gold answer, and their Primary OEMs are correctly listed as 'n/a'. The model's additional details about the companies' products and locations do not detract from its correctness. | gemma_rag: The model-generated answer contains the same two Georgia companies with an EV Supply Chain Role related to wiring harnesses as the gold answer, and their Primary OEMs are correctly listed as 'n/a'. The model's additional details about the companies' products and locations do not detract from its correctness. | qwen_norag: The model-generated answer is off-topic and does not provide the required information about Georgia companies with an EV Supply Chain Role related to wiring harnesses and their Primary OEMs. | gemma_norag: The model-generated answer is partly correct with important missing pieces. It correctly identifies the need for detailed supply chain data and mentions automotive suppliers and manufacturers in Georgia, but fails to provide specific companies and their primary OEM relationships as requested."
16,Find Georgia-based Tier 1 or Tier 1/2 suppliers capable of producing battery electrolytes or lithium-ion battery materials with existing OEM contracts.,0.85,correct,0.85,correct,0.4,partially_correct,0.4,partially_correct,tie,"qwen_rag: The model-generated answer contains all required gold entities and mappings, but omits the narrative preamble. The core entities, mappings, counts, top items, and locations match the gold answer. | gemma_rag: The model-generated answer contains all required gold entities and mappings, but omits the narrative preamble. The core entities, mappings, counts, top items, and locations match the gold answer. | qwen_norag: The model-generated answer is partly correct with important missing pieces. It correctly identifies the context of major automotive suppliers in Georgia but fails to provide specific companies matching the gold answer's criteria. | gemma_norag: The model-generated answer is partly correct with important missing pieces. It correctly identifies the need for detailed supply chain information and mentions that Georgia's attractiveness suggests it could host such facilities, but it fails to provide specific suppliers and contracts as requested."
17,Which Georgia companies manufacture high-voltage wiring harnesses or EV electrical distribution components suitable for BEV platforms?,0.95,correct,0.95,correct,0.4,partially_correct,0.4,partially_correct,tie,"qwen_rag: The model-generated answer contains the same core entities (WIKA USA and Woodbridge Foam Corp.) with matching roles, products, and locations as the gold answer. The count of companies is also correct. However, the narrative framing and extra metadata in the gold answer are not present in the model-generated answer. | gemma_rag: The model-generated answer contains the same two companies (WIKA USA and Woodbridge Foam Corp.) as the gold answer, with matching roles, products, and locations. The only difference is that the model-generated answer includes extra metadata such as employment numbers and facility fields, but this does not affect the core correctness of the answer. | qwen_norag: The model-generated answer is partly correct with important missing pieces. It mentions that companies specializing in automotive parts and components manufacture high-voltage wiring harnesses and EV electrical distribution components, but it does not provide specific company names or details as the gold answer does. | gemma_norag: The model-generated answer is partly correct with important missing pieces. It mentions that identifying specific companies requires detailed supplier lists, but it does not provide any actual company names or details. The gold answer provides two specific companies (WIKA USA and Woodbridge Foam Corp.) that manufacture high-voltage wiring harnesses or EV electrical distribution components suitable for BEV platforms."
18,Identify Georgia Tier 2/3 companies in the Electronic and Electrical Equipment industry group that could be upgraded to supply EV power electronics.,0.4,partially_correct,0.4,partially_correct,0.4,partially_correct,0.4,partially_correct,tie,"qwen_rag: The model-generated answer contains some correct entities (GSC Steel Stamping LLC, Jackson America, Inc.), but it also includes irrelevant information (Toyota Industries Electric Systems North, Hyundai Kia Rivian) and lacks the core message of the gold answer (there are no Georgia Tier 2/3 companies in the Electronic and Electrical Equipment industry group). | gemma_rag: The model-generated answer contains some correct information about GSC Steel Stamping LLC, but it is missing the crucial fact that there are no Georgia Tier 2/3 companies listed under the Electronic and Other Electrical Equipment and Components industry group. The answer also includes extra metadata such as employment, location, and facility type, which are not relevant to the question. | qwen_norag: The model-generated answer partially identifies the type of companies that could potentially supply EV power electronics (those involved in manufacturing electronic and electrical equipment with capabilities in power management and semiconductor technologies). However, it fails to provide a specific list or count of Georgia Tier 2/3 companies in the Electronic and Electrical Equipment industry group, which is crucial for answering the question. The answer also lacks clarity on how these companies could be upgraded to supply EV power electronics. | gemma_norag: The model-generated answer partially addresses the question by mentioning potential upgrade paths for Tier 2/3 companies in electronic/electrical equipment, but it fails to provide a clear and direct answer to the specific question about Georgia companies in the Electronic and Electrical Equipment industry group that could be upgraded to supply EV power electronics. The gold answer explicitly states 'There are no Georgia Tier 2/3 companies listed under the Electronic and Other Electrical Equipment and Components industry group', which is not addressed by the model-generated answer."
19,Find Georgia-based companies that manufacture copper foil or electrodeposited materials suitable for EV battery current collectors.,0.95,correct,0.85,correct,0.4,partially_correct,0.4,partially_correct,qwen_rag,"qwen_rag: The model-generated answer matches the gold answer in core entities (Duckyang), mappings (electrodeposited copper foil for EV battery current collectors), and location (Braselton, Jackson County). The only difference is the inclusion of extra metadata such as tier, OEM, employment, and facility fields, which do not affect the correctness of the answer. | gemma_rag: The model-generated answer contains all required gold entities and mappings, but lacks the narrative preamble found in the human-validated gold answer. | qwen_norag: The model-generated answer is partly correct with some important missing pieces. It correctly identifies the involvement of advanced manufacturing and technology sectors in Georgia, but fails to provide specific companies that manufacture copper foil or electrodeposited materials suitable for EV battery current collectors. | gemma_norag: The model-generated answer partially identifies the need for specialized knowledge and mentions Georgia's manufacturing base, but fails to provide specific companies that match the gold answer."
20,"Which Georgia Tier 1/2 companies produce engineered plastics, polymers, or composite materials applicable to EV structural or thermal components?",0.95,correct,0.4,partially_correct,0.4,partially_correct,0.4,partially_correct,qwen_rag,"qwen_rag: The model-generated answer 'Not found in provided context' is a paraphrase of the gold answer and accurately reflects that no Georgia Tier 1/2 companies are explicitly identified as producing engineered plastics, polymers, or composite materials applicable to EV structural or thermal components. | gemma_rag: The model-generated answer contains some correct entities (F&P Georgia Manufacturing, Fouts Brothers Fire Equipment, Hwashin, Hyundai Transys Georgia Powertrain) but also includes incorrect or unrelated information (Hyundai Motor Group, Hyundai Industrial Co.). The gold answer explicitly states that no Georgia Tier 1/2 companies are identified as producing engineered plastics, polymers, or composite materials applicable to EV structural or thermal components. Therefore, the model-generated answer is partly correct with important missing pieces. | qwen_norag: The model-generated answer is partly correct with important missing pieces. It correctly identifies the type of companies involved (Tier 1/2) and their expertise in advanced materials for vehicle manufacturing, but fails to provide any specific company names or details that match the gold answer's explicit statement that no Georgia Tier 1/2 companies are identified as producing engineered plastics, polymers, or composite materials applicable to EV structural or thermal components. | gemma_norag: The model-generated answer is partly correct with important missing pieces. It correctly identifies the need for lightweighting and thermal management in electric vehicles, but fails to provide specific Georgia Tier 1/2 companies that produce engineered plastics, polymers, or composite materials applicable to EV structural or thermal components."
